<?xml version="1.0" encoding="UTF-8" ?>
<Etudiants xmlns:xsi="http://www.w3.org/2001/XMLSchema-instance" xsi:noNamespaceSchemaLocation="bd.xsd">
	<Etudiant>
		<Personne ID="lb54">
			<Nom>Le Botlan</Nom>
			<Prenom>Didier</Prenom>
			<Anniv>1998-08-08</Anniv>
		</Personne>
		<Matieres>
			<MatID MatiereID="p42">
				<Note>10</Note>
			</MatID>
		</Matieres>
		<Annee>45</Annee>
		<Cursus>Info</Cursus>
		<Groupe>TDA</Groupe>
	</Etudiant>
	<Etudiant>
	<Personne ID="lb55">
		<Nom>Bastien</Nom>
		<Prenom>Delegue</Prenom>
		<Anniv>1998-01-08</Anniv>
	</Personne>
	<Matieres>
		<MatID MatiereID="p42">
			<Note>30</Note>
		</MatID>
	</Matieres>
	<Annee>44</Annee>
	<Cursus>Info</Cursus>
	<Groupe>TDA</Groupe>
	</Etudiant>
	<Etudiant>
	<Personne ID="lb56">
		<Nom>Truc</Nom>
		<Prenom>Chose</Prenom>
		<Anniv>1988-10-08</Anniv>
	</Personne>
	<Matieres>
		<MatID MatiereID="p97">
			<Note>8</Note>
			<Note>12</Note>
		</MatID>
	</Matieres>
	<Annee>45</Annee>
	<Cursus>GC</Cursus>
	<Groupe>TDA</Groupe>
	</Etudiant>
</Etudiants>
